{
  "eventId": "5b111111-1111-4111-8111-111111111111",
  "eventType": "evidence.review-decided",
  "schemaVersion": 1,
  "tenantId": "tenant-byd",
  "correlationId": "corr-m44-decide",
  "causationId": "decide-review-1",
  "aggregateType": "ReviewCase",
  "aggregateId": "5a222222-2222-4222-8222-222222222222",
  "aggregateVersion": 1,
  "occurredAt": "2026-07-14T14:05:00Z",
  "payload": {
    "reviewCaseId": "5a222222-2222-4222-8222-222222222222",
    "reviewDecisionId": "5b222222-2222-4222-8222-222222222222",
    "evidenceSetSnapshotId": "5a333333-3333-4333-8333-333333333333",
    "taskId": "88888888-8888-4888-8888-888888888888",
    "projectId": "33333333-3333-4333-8333-333333333333",
    "decision": "REJECTED",
    "decisionSource": "INTERNAL",
    "reasonCodes": ["IMAGE.BLUR"],
    "decidedBy": "reviewer-hq",
    "decidedAt": "2026-07-14T14:05:00Z"
  }
}
